{
  "schema_version": "2.0.0",
  "created_at": "2026-04-06T16:12:06Z",
  "bypass": "skip_remote_gate",
  "source": "pre-push-hook",
  "branch": "main",
  "commit": "edf64725aface89485bf5098465cad888f0cfeff",
  "waiver": {
    "reason_code": "runner_image_pull_failure",
    "reason_summary": "The gate runner images or their registry path could not be pulled even though the surrounding gate contract was otherwise healthy.",
    "detail": "Harbor registry.lv3.org returning 502; stack.yaml live-apply receipt commit",
    "impacted_lanes": [
      "remote-pre-push-gate"
    ],
    "substitute_evidence": [
      "live-apply receipt only",
      "no code changes"
    ],
    "owner": "baditaflorin@gmail.com",
    "expires_on": "2026-04-08",
    "remediation_ref": "restore-harbor-registry"
  }
}
