{
  "schema_version": "2.0.0",
  "created_at": "2026-04-08T13:52:58Z",
  "bypass": "skip_remote_gate",
  "source": "pre-push-hook",
  "branch": "verify",
  "commit": "41194ccdf5ef04d209bf2b043aa7c976e12e0171",
  "waiver": {
    "reason_code": "build_server_unreachable",
    "reason_summary": "The remote build-server gate could not be reached or stayed unavailable long enough to block the governed pre-push path.",
    "detail": "Final 3 ADR upgrades: 0224 0307 0346",
    "impacted_lanes": [
      "adr-final-cleanup"
    ],
    "substitute_evidence": [
      "receipts/gate-bypasses/20260408T014200Z-verify-e6735fb-skip-remote-gate.json"
    ],
    "owner": "baditaflorin@gmail.com",
    "expires_on": "2026-04-10",
    "remediation_ref": "Full ADR audit complete \u2014 331/411 Implemented"
  }
}
