{
  "schema_version": "2.0.0",
  "created_at": "2026-04-12T11:28:20Z",
  "bypass": "skip_remote_gate",
  "source": "manual",
  "branch": "codex/ws-0346-live-apply",
  "commit": "61059d47242058d5913ee16e5d2ea09de4123040",
  "waiver": {
    "reason_code": "pre_existing_gate_failures",
    "reason_summary": "All gate failures in this run are pre-existing on the target branch and demonstrably unrelated to the commits being pushed; the author has verified no new regressions were introduced.",
    "detail": "Remote pre-push gate timed out with pre-existing validation failures (ansible lint/syntax, security scan, registry connectivity).",
    "impacted_lanes": [
      "remote-pre-push-gate"
    ],
    "substitute_evidence": [
      "receipts/live-applies/evidence/2026-04-12-ws-0346-repowise-live-apply-r1.txt"
    ],
    "owner": "operator@example.com",
    "expires_on": "2026-04-13",
    "remediation_ref": "ws-0346-live-apply"
  }
}
