{
  "schema_version": "2.0.0",
  "created_at": "2026-04-07T22:00:17Z",
  "bypass": "skip_remote_gate",
  "source": "pre-push-hook",
  "branch": "main",
  "commit": "0715143a356dc14727fd5517a7e2bdfc103eab69",
  "waiver": {
    "reason_code": "build_server_unreachable",
    "reason_summary": "The remote build-server gate could not be reached or stayed unavailable long enough to block the governed pre-push path.",
    "detail": "Add extra_hosts for OIDC hairpin NAT",
    "impacted_lanes": [
      "remote-pre-push-gate"
    ],
    "substitute_evidence": [
      "hairpin-nat-fix"
    ],
    "owner": "baditaflorin@gmail.com",
    "expires_on": "2026-04-09",
    "remediation_ref": "0715143a3"
  }
}
