{
  "schema_version": "2.0.0",
  "created_at": "2026-04-10T02:50:05Z",
  "bypass": "skip_remote_gate",
  "source": "pre-push-hook",
  "branch": "main",
  "commit": "9e9d7316416bf10c43833fc7181fdbaf5ccc7123",
  "waiver": {
    "reason_code": "runner_image_pull_failure",
    "reason_summary": "The gate runner images or their registry path could not be pulled even though the surrounding gate contract was otherwise healthy.",
    "detail": "Build server unavailable; local validation passed",
    "impacted_lanes": [
      "remote-pre-push-gate"
    ],
    "substitute_evidence": [
      "subdomain_catalog_validate_pass",
      "subdomain_exposure_audit_validate_pass"
    ],
    "owner": "baditaflorin@gmail.com",
    "expires_on": "2026-04-12",
    "remediation_ref": "docs/runbooks/gate-bypass-recovery.md"
  }
}
