{
  "schema_version": "2.0.0",
  "created_at": "2026-04-07T23:13:52Z",
  "bypass": "skip_remote_gate",
  "source": "pre-push-hook",
  "branch": "main",
  "commit": "7755afe447891aa7ec837ba4b11345f1f803419d",
  "waiver": {
    "reason_code": "build_server_unreachable",
    "reason_summary": "The remote build-server gate could not be reached or stayed unavailable long enough to block the governed pre-push path.",
    "detail": "Receipt-only commit",
    "impacted_lanes": [
      "remote-pre-push-gate"
    ],
    "substitute_evidence": [
      "prior-bypass-receipt"
    ],
    "owner": "baditaflorin@gmail.com",
    "expires_on": "2026-04-09",
    "remediation_ref": "docs/adr/0364-native-build-server-gate-execution.md"
  }
}
