{
  "schema_version": "2.0.0",
  "created_at": "2026-04-06T18:16:26Z",
  "bypass": "skip_remote_gate",
  "source": "pre-push-hook",
  "branch": "main",
  "commit": "81a6388f53a17c2195da784ab7d05eaee200bd7b",
  "waiver": {
    "reason_code": "runner_image_pull_failure",
    "reason_summary": "The gate runner images or their registry path could not be pulled even though the surrounding gate contract was otherwise healthy.",
    "detail": "registry.lv3.org returning 502 for check-runner python:3.12.10 image; all local schema, data model, workstream, agent-standards, and canonical truth validations pass",
    "impacted_lanes": [
      "remote-pre-push-gate"
    ],
    "substitute_evidence": [
      "validate_repository_data_models --validate: OK",
      "validate_repo.sh agent-standards: OK",
      "canonical_truth.py --check: OK",
      "generate_dependency_diagram.py --check: OK"
    ],
    "owner": "baditaflorin@gmail.com",
    "expires_on": "2026-04-08",
    "remediation_ref": "retry-next-push"
  }
}
