{
  "schema_version": "2.0.0",
  "created_at": "2026-04-06T18:28:54Z",
  "bypass": "skip_remote_gate",
  "source": "pre-push-hook",
  "branch": "main",
  "commit": "dc3992ea71cce2ead3e7c4d855cbe6490a7bdcb1",
  "waiver": {
    "reason_code": "build_server_unreachable",
    "reason_summary": "The remote build-server gate could not be reached or stayed unavailable long enough to block the governed pre-push path.",
    "detail": "Remote build server SSH connection stalled; chore commit adds bypass receipts only, no functional changes",
    "impacted_lanes": [
      "remote-pre-push-gate"
    ],
    "substitute_evidence": [
      "All validators passed locally on prior merge commits 681666d8e and 6facc9565"
    ],
    "owner": "baditaflorin@gmail.com",
    "expires_on": "2026-04-08",
    "remediation_ref": "n/a-chore-only"
  }
}
