{
  "schema_version": "2.0.0",
  "created_at": "2026-04-07T11:55:36Z",
  "bypass": "skip_remote_gate",
  "source": "pre-push-hook",
  "branch": "claude/happy-johnson",
  "commit": "a41fb75b4af58953dc32811b71d2c594ee78b205",
  "waiver": {
    "reason_code": "build_server_unreachable",
    "reason_summary": "The remote build-server gate could not be reached or stayed unavailable long enough to block the governed pre-push path.",
    "detail": "build server remote gate unresponsive",
    "impacted_lanes": [
      "remote-pre-push-gate"
    ],
    "substitute_evidence": [
      "local-pre-commit-passed"
    ],
    "owner": "baditaflorin@gmail.com",
    "expires_on": "2026-04-09",
    "remediation_ref": "investigate-build-server-gate-hang"
  }
}
