{
  "schema_version": "2.0.0",
  "created_at": "2026-04-07T20:56:33Z",
  "bypass": "skip_remote_gate",
  "source": "pre-push-hook",
  "branch": "main",
  "commit": "1bcd454e08075323f1775dc818af7cc7e27e71ec",
  "waiver": {
    "reason_code": "build_server_unreachable",
    "reason_summary": "The remote build-server gate could not be reached or stayed unavailable long enough to block the governed pre-push path.",
    "detail": "Fix LibreChat YAML config to match v0.8.4 schema",
    "impacted_lanes": [
      "remote-pre-push-gate"
    ],
    "substitute_evidence": [
      "librechat-config-schema-fix"
    ],
    "owner": "baditaflorin@gmail.com",
    "expires_on": "2026-04-09",
    "remediation_ref": "1bcd454e0"
  }
}
