{
  "schema_version": "2.0.0",
  "created_at": "2026-04-06T12:53:13Z",
  "bypass": "skip_remote_gate",
  "source": "pre-push-hook",
  "branch": "claude/happy-johnson",
  "commit": "f80ad57e4e8677e46a54c8f980b869eb595f6fd6",
  "waiver": {
    "reason_code": "emergency_hotfix",
    "reason_summary": "A break-glass production fix required a governed push before the normal validation lane could be fully restored.",
    "detail": "browser-runner service was deployed and running but not accessible due to missing firewall rules on docker-runtime-lv3. Added nftables rules for port 8096 from management network, all guests, and docker bridge networks.",
    "impacted_lanes": [
      "remote-pre-push-gate"
    ],
    "substitute_evidence": [
      "firewall rule deployment verified",
      "browser-runner service responding on port 8096 from all required networks"
    ],
    "owner": "claude-code",
    "expires_on": "2026-04-07",
    "remediation_ref": "fcc3f06e8: Add browser-runner port 8096 firewall rules to docker-runtime-lv3"
  }
}
