{
  "schema_version": "2.0.0",
  "created_at": "2026-04-08T01:42:00Z",
  "bypass": "skip_remote_gate",
  "source": "pre-push-hook",
  "branch": "verify",
  "commit": "e6735fb2d0f53f258c3757ac4ac251beaeb5ddde",
  "waiver": {
    "reason_code": "build_server_unreachable",
    "reason_summary": "The remote build-server gate could not be reached or stayed unavailable long enough to block the governed pre-push path.",
    "detail": "ADR 9-batch update push; validation gate slow",
    "impacted_lanes": [
      "adr-batch-9"
    ],
    "substitute_evidence": [
      "receipts/gate-bypasses/20260408T014139Z-verify-e05525a-skip-remote-gate.json"
    ],
    "owner": "baditaflorin@gmail.com",
    "expires_on": "2026-04-10",
    "remediation_ref": "docs/adr/.index.yaml regenerated"
  }
}
