{
  "schema_version": "2.0.0",
  "created_at": "2026-04-06T17:44:09Z",
  "bypass": "skip_remote_gate",
  "source": "pre-push-hook",
  "branch": "claude/happy-johnson",
  "commit": "f336c06114b5424a23c833c62b38c5b6433699ba",
  "waiver": {
    "reason_code": "build_server_unreachable",
    "reason_summary": "The remote build-server gate could not be reached or stayed unavailable long enough to block the governed pre-push path.",
    "detail": "registry.lv3.org 502 blocking check-runner image pull",
    "impacted_lanes": [
      "remote-pre-push-gate"
    ],
    "substitute_evidence": [
      "local-pre-commit-passed"
    ],
    "owner": "baditaflorin@gmail.com",
    "expires_on": "2026-04-08",
    "remediation_ref": "ADR-0375"
  }
}
