{
  "schema_version": "2.0.0",
  "created_at": "2026-04-05T20:48:33Z",
  "bypass": "skip_remote_gate",
  "source": "pre-push-hook",
  "branch": "main",
  "commit": "b6e5b047a347dde909fc40cd4f8fded94f096632",
  "waiver": {
    "reason_code": "build_server_unreachable",
    "reason_summary": "The remote build-server gate could not be reached or stayed unavailable long enough to block the governed pre-push path.",
    "detail": "Remote pre-push gate fell back to local fallback. All failing checks (agent-standards, ansible-lint, atlas-lint, schema-validation, service-completeness) are pre-existing on origin/main and not introduced by ADR-0346 Outline automation merge.",
    "impacted_lanes": [
      "remote-pre-push-gate"
    ],
    "substitute_evidence": [
      "All failures confirmed pre-existing on origin/main HEAD (1d6f1402c)",
      "type-check",
      "documentation-index",
      "generated-portals",
      "security-scan all passed"
    ],
    "owner": "baditaflorin@gmail.com",
    "expires_on": "2026-04-07",
    "remediation_ref": "docs/adr/0346-outline-programmatic-wiki-api-and-automation-hooks.md"
  }
}
