{
  "schema_version": "2.0.0",
  "created_at": "2026-04-10T11:19:50Z",
  "bypass": "skip_remote_gate",
  "source": "pre-push-hook",
  "branch": "main",
  "commit": "37d3d45ad4dbeb83e32271ea7a0473203d5f14fd",
  "waiver": {
    "reason_code": "gate_timeout",
    "reason_summary": "The gate validation exceeded the maximum allowed execution time without completing all checks.",
    "detail": "Remote pre-push gate timed out during SSH to build server 10.10.10.30. Change is documentation-only: ADR 0399, ADR 0400, homepage CSS fix.",
    "impacted_lanes": [
      "remote-pre-push-gate"
    ],
    "substitute_evidence": [
      "remote-gate-hung-on-build-server-ssh-for-5min"
    ],
    "owner": "baditaflorin@gmail.com",
    "expires_on": "2026-04-11",
    "remediation_ref": "ADR-0399-0400"
  }
}
