{
  "schema_version": "2.0.0",
  "created_at": "2026-04-10T12:13:13Z",
  "bypass": "skip_remote_gate",
  "source": "pre-push-hook",
  "branch": "main",
  "commit": "33d00d854609a8f881079089fe387ce81dcd0064",
  "waiver": {
    "reason_code": "gate_timeout",
    "reason_summary": "The gate validation exceeded the maximum allowed execution time without completing all checks.",
    "detail": "ADR 0399 Phase 1 reconciliation library \u2014 new Python module and Makefile targets only.",
    "impacted_lanes": [
      "remote-pre-push-gate"
    ],
    "substitute_evidence": [
      "remote-gate-hung-earlier-same-session"
    ],
    "owner": "baditaflorin@gmail.com",
    "expires_on": "2026-04-11",
    "remediation_ref": "ADR-0399-phase1"
  }
}
