{
  "schema_version": "2.0.0",
  "created_at": "2026-04-06T18:29:53Z",
  "bypass": "skip_remote_gate",
  "source": "pre-push-hook",
  "branch": "main",
  "commit": "f1ae3dc87be030056fa8123ba658963f2c8ae96e",
  "waiver": {
    "reason_code": "build_server_unreachable",
    "reason_summary": "The remote build-server gate could not be reached or stayed unavailable long enough to block the governed pre-push path.",
    "detail": "Remote gate SSH stalled; chore commit adds bypass receipt only",
    "impacted_lanes": [
      "remote-pre-push-gate"
    ],
    "substitute_evidence": [
      "All validators passed on d49598ba9"
    ],
    "owner": "baditaflorin@gmail.com",
    "expires_on": "2026-04-08",
    "remediation_ref": "n/a-chore-only"
  }
}
