{
  "schema_version": "2.0.0",
  "created_at": "2026-04-07T22:28:12Z",
  "bypass": "skip_remote_gate",
  "source": "pre-push-hook",
  "branch": "claude/happy-johnson",
  "commit": "03e5c3a885265547a64284722dc82c8e6e0a831b",
  "waiver": {
    "reason_code": "runner_image_pull_failure",
    "reason_summary": "The gate runner images or their registry path could not be pulled even though the surrounding gate contract was otherwise healthy.",
    "detail": "Docker registry registry.lv3.org not reachable from local machine",
    "impacted_lanes": [
      "remote-pre-push-gate"
    ],
    "substitute_evidence": [
      "make validate-local passed",
      "pre-commit hooks passed"
    ],
    "owner": "Florin Badita-Nistor",
    "expires_on": "2026-04-09",
    "remediation_ref": "docs/adr/0382-convergence-speed-and-incremental-apply.md"
  }
}
