{
  "schema_version": "2.0.0",
  "created_at": "2026-04-08T14:02:12Z",
  "bypass": "skip_remote_gate",
  "source": "pre-push-hook",
  "branch": "verify",
  "commit": "51a5816a1b1432926ca46c2b4b758cdbb75ef6b7",
  "waiver": {
    "reason_code": "runner_image_pull_failure",
    "reason_summary": "The gate runner images or their registry path could not be pulled even though the surrounding gate contract was otherwise healthy.",
    "detail": "gate runner image not available locally",
    "impacted_lanes": [
      "remote-pre-push-gate"
    ],
    "substitute_evidence": [
      "convergence-passed-97-ok-0-failed"
    ],
    "owner": "baditaflorin@gmail.com",
    "expires_on": "2026-04-10",
    "remediation_ref": "rebuild-gate-runner-image"
  }
}
